{
  "context": null,
  "reviewed_commit": null,
  "accepted": "true",
  "issue_details": {},
  "reviewed_artifacts": {
    "requirements": {
      "ref": ".docs/specs/example/requirements.md",
      "version": 1
    },
    "design": {
      "ref": ".docs/specs/example/design.md",
      "version": 1
    },
    "tasks": {
      "ref": ".docs/specs/example/tasks.md",
      "version": 1
    }
  },
  "reviewed_output_ref": null,
  "review_kind": "follow_up",
  "assurance_level": "standard",
  "repair_class": "bounded_correctness",
  "changed_surfaces": [
    "src/example.py"
  ],
  "review_scope": "full",
  "scope_reason": "Cover the complete relevant work on the initial pass; verify affected contracts on repair.",
  "meaningful_change": true,
  "evidence": [
    {
      "sources": [
        {
          "ref": "src/example.py",
          "context": "Feature baseline and current working changes inspected"
        }
      ],
      "observations": [
        "The implemented branch meets the approved acceptance criterion."
      ],
      "assumptions": [
        "The approved deployment remains local."
      ],
      "freshness": "new",
      "applicability_check": "Compared relevant source content and deployment assumptions with the prior inspection."
    }
  ],
  "resolved_findings": [
    "C-0-1"
  ],
  "checks": [
    {
      "name": "behavioral-tests",
      "status": "pass",
      "required": true,
      "details": "Expected result and preservation witness passed."
    }
  ],
  "summary": "Prior standalone report identified the empty-input defect. The user selected repair; the current source and behavioral witness confirm it is fixed. There are no current findings."
}
